{"body":{"state":"BLOCKED"},"content_sha256":"514968bbc9fc1cdb9839328b6c61409298b02af11a82d93520ca4605ae06235c","expires_at":1792122772,"id":"phase2-preparation","issued_at":1792121872,"kind":"HEARTBEAT","mode":"SHADOW","policy_sha256":"f0762f00d6ee75ed09e0520e04525918b3f63312f36595cf28174d5bca703ea5","previous":"0000000000000000000000000000000000000000000000000000000000000000","role":"worker","sequence":1,"signature":"5fe5e40462116b8be954afa7c5582e1d310374292c4476a712f7cb31808e6235f1a66cf88dfe4b809e2fdabbec18d21fceb41d21994694223cb4db76de2ff603","version":1}