{"body":{"directive_id":"d1-f24714f48bd39707","effort_id":"effort-d1-f24714f48bd39707","evidence":{"category":"EXECUTION_UNCERTAIN"},"status":"NEEDS_HUMAN","task_id":"ddb-task-d1-f24714f48bd39707"},"content_sha256":"7675ee76ed3d07f45f1ce9df88d78bb81473a525b7998c1d4bb353f5440c117e","expires_at":1792373132,"id":"report-d1-f24714f48bd39707","issued_at":1792372232,"kind":"REPORT","mode":"SHADOW","policy_sha256":"dc13ce2631f917271f3eb1921e4d6605b12850f5bfc664dcc9e449e15df5d704","previous":"5ef7df74c711eabfadd9db429e5af842d71aa3f0679291ccdc1ab7a1b31d92a3","role":"worker","sequence":10,"signature":"0a0916cd44cd27f96406b2913ad5c69c244b3f71b69c440c16fe9cc923da5ef7351d044d5a7e167264d9a6202ec182bb65fb8026e2eabd034cb7e258c7f6e40c","version":1}