{"body":{"directive_digest":"662b96657226da775f47368ae068f5343edd462a72f0f403ad9dae8aab8bcbdd","directive_id":"d1-f24714f48bd39707","state":"DURABLY_RECEIVED"},"content_sha256":"4f4303cb3c12a81390b7f48f1e9015027e914fccfc5673a334a66477ff77dd37","expires_at":1792373132,"id":"ack-d1-f24714f48bd39707","issued_at":1792372232,"kind":"ACK","mode":"SHADOW","policy_sha256":"dc13ce2631f917271f3eb1921e4d6605b12850f5bfc664dcc9e449e15df5d704","previous":"8e122dde2b73401a621e9665593c72f6307cf1a0311c316a84f9124100b9458a","role":"worker","sequence":9,"signature":"4c0811e7f826b43b39756ae439cc8cf97f8f50ef50320f7ebcf03db3a3c97377f55b404036268bafdbb7cdfda47d9fc138de2f647814411ba09f6ee0ca078605","version":1}