{"body":{"state":"IDLE"},"content_sha256":"9d1b706b90e271e1dd1775d385052801f57427e07a33860e276731fda288b878","expires_at":1792373107,"id":"heartbeat-1792372207","issued_at":1792372207,"kind":"HEARTBEAT","mode":"SHADOW","policy_sha256":"dc13ce2631f917271f3eb1921e4d6605b12850f5bfc664dcc9e449e15df5d704","previous":"f24714f48bd3970770c191f2dd769dde8f3f6e418427167dd92f9ecf905262b3","role":"worker","sequence":7,"signature":"65ffd236b4807fc02fa1204c58940f42e49adc218877fa9197b09026955cebde006ca996bf33a5bb5983f9a105cf50e43c750cd7fe9121a0092d2c4377b15501","version":1}