{"body":{"directive_id":null,"effort_id":"initial-idle-dc13ce2631f9","evidence":null,"status":"IDLE","task_id":null},"content_sha256":"954115ca5119bcd1a2bfa52fd474e912482bcb6949e7c84ddaedc5a762f5dd88","expires_at":1792373107,"id":"initial-idle-dc13ce2631f9","issued_at":1792372207,"kind":"REPORT","mode":"SHADOW","policy_sha256":"dc13ce2631f917271f3eb1921e4d6605b12850f5bfc664dcc9e449e15df5d704","previous":"ba714167bbec2368956d641422d3f75aad7365119f2481b7fe073e4ff63d999f","role":"worker","sequence":6,"signature":"58a28c315b0dab74cfcaf896492f28d16f7251cb742755f51e36411ab786568481f33002b3b3bb8e3338adeb0afc7d125c958125059c65639f35161d6a446506","version":1}