{"body":{"correlation_id":"ddb-corr-d1-f24714f48bd39707","directive_id":"d1-f24714f48bd39707","source_report":"f24714f48bd3970770c191f2dd769dde8f3f6e418427167dd92f9ecf905262b3","task_id":"ddb-task-d1-f24714f48bd39707","template":"codex_shadow_review_v1"},"content_sha256":"42749e87581aae54635b640ea839f98dde10e15862af766a2b453135633dc4bc","expires_at":1792373124,"id":"directive-d1-f24714f48bd39707","issued_at":1792372224,"kind":"DIRECTIVE","mode":"SHADOW","policy_sha256":"dc13ce2631f917271f3eb1921e4d6605b12850f5bfc664dcc9e449e15df5d704","previous":"0000000000000000000000000000000000000000000000000000000000000000","role":"supervisor","sequence":1,"signature":"ca78682e6d44763b21daef99afaf3785dcbe10010037909cd65dd07587418592709a8751047fec723ae2ee59160b7d99d16f3881a12f68e8bb3efa02386b8b0f","version":1}