{"body":{"state":"IDLE"},"content_sha256":"f4fcab51185389dc3414fc7ed2a271019ee2b0c3aa4ea363e9b62a05dc60b944","expires_at":1792125472,"id":"heartbeat-1792125217","issued_at":1792125217,"kind":"HEARTBEAT","mode":"SHADOW","policy_sha256":"f0762f00d6ee75ed09e0520e04525918b3f63312f36595cf28174d5bca703ea5","previous":"50eeadf95896b61c1e7c078fce4d85d4d6d122852f01faee3fde3cd6f209a9a9","role":"worker","sequence":4,"signature":"ac4114a57707fe81e094bd2beae861e4aafee7511afe81e8c66460d3482ad039f4611e9122a9e54139e711dc4a09b18160b41b192075fcd9339263164bfb5a0f","version":1}