{"body":{"state":"IDLE"},"content_sha256":"3dd103aea155fcea1562b78144dfa8e3a35b60ab12d842dfdf95d0c8bc7f2b9e","expires_at":1792373152,"id":"native-admission-1792372252","issued_at":1792372252,"kind":"HEARTBEAT","mode":"SHADOW","policy_sha256":"dc13ce2631f917271f3eb1921e4d6605b12850f5bfc664dcc9e449e15df5d704","previous":"5a0dd3c393012280585e68534afb7b9c160b4275aedb48dba17a5135adcb5fe6","role":"worker","sequence":12,"signature":"f14f0af45875074b739502579e844b6521af7898fb5a7a223192c54f624bc61ff329fc2cc0003af334542e4c7e8cdce1b53923cc8866f35e925f2f4e6ce4cb0e","version":1}