{"body":{"state":"BLOCKED"},"content_sha256":"d42feee6d65a46b0a0b278c1889e2d0ee659d8fc7e2af421800369af36f7002e","expires_at":1792373132,"id":"heartbeat-1792372232","issued_at":1792372232,"kind":"HEARTBEAT","mode":"SHADOW","policy_sha256":"dc13ce2631f917271f3eb1921e4d6605b12850f5bfc664dcc9e449e15df5d704","previous":"769563c5fda7f1fda5f90ac51711feee6d90237b2f20822d35b8c7d6d54f18f9","role":"worker","sequence":11,"signature":"8c564c955bb8fe2390b4c639bf7350d8d5da9839fa6c13f5a99ba5f56b7f6414f663bbdbb533dcbca68a9a730320d164a1c73bf9687228da74fd6792c0248c07","version":1}