{"body":{"directive_id":null,"effort_id":"initial-idle","evidence":null,"status":"IDLE","task_id":null},"content_sha256":"402ee1c5316f2b94026b379e34b7c0331fd74beb9462b1c6b9079ce13895fbc1","expires_at":1792125472,"id":"initial-idle","issued_at":1792125217,"kind":"REPORT","mode":"SHADOW","policy_sha256":"f0762f00d6ee75ed09e0520e04525918b3f63312f36595cf28174d5bca703ea5","previous":"b0544c145223adf32e9fae8e2f11c67ab808ad2930a4a5847c64f57864aeb300","role":"worker","sequence":3,"signature":"cc50a3ef9068429477a7a8c5ffb8c1fe1c3671cb580c7be8f49c038823f51e052ddd06235bc80278108259f2cce9d2d668d9e5a82dfa1e0b79ada0bcbd7ea701","version":1}